{
    "$schema": "habitat.schema.json",
    "land_text": "none",
    "habitats": {
        "land": false,
        "water": true,
        "fishing": true
    },
    "by_season": {
        "land": true,
        "water": true,
        "fishing": true
    },
    "species": [
        {
            "species": "SPECIES_WINGULL",
            "land": [],
            "water": [ "spring", "summer", "autumn", "winter" ],
            "fishing": []
        },
        {
            "species": "SPECIES_FRILLISH",
            "land": [],
            "water": [ "spring", "summer", "autumn", "winter" ],
            "fishing": []
        },
        {
            "species": "SPECIES_CARVANHA",
            "land": [],
            "water": [ "spring", "summer", "autumn", "winter" ],
            "fishing": []
        },
        {
            "species": "SPECIES_WAILMER",
            "land": [],
            "water": [ "spring", "summer", "autumn", "winter" ],
            "fishing": []
        },
        {
            "species": "SPECIES_TENTACOOL",
            "land": [],
            "water": [ "spring", "summer", "autumn", "winter" ],
            "fishing": []
        },
        {
            "species": "SPECIES_PELIPPER",
            "land": [],
            "water": [ "spring", "summer", "autumn", "winter" ],
            "fishing": []
        },
        {
            "species": "SPECIES_JELLICENT",
            "land": [],
            "water": [ "spring", "summer", "autumn", "winter" ],
            "fishing": []
        },
        {
            "species": "SPECIES_SHARPEDO",
            "land": [],
            "water": [ "spring", "summer", "autumn", "winter" ],
            "fishing": []
        },
        {
            "species": "SPECIES_HORSEA",
            "land": [],
            "water": [],
            "fishing": [ "spring", "summer", "autumn", "winter" ]
        },
        {
            "species": "SPECIES_CHINCHOU",
            "land": [],
            "water": [],
            "fishing": [ "spring", "summer", "autumn", "winter" ]
        },
        {
            "species": "SPECIES_REMORAID",
            "land": [],
            "water": [],
            "fishing": [ "spring", "summer", "autumn", "winter" ]
        },
        {
            "species": "SPECIES_QWILFISH",
            "land": [],
            "water": [],
            "fishing": [ "spring", "summer", "autumn", "winter" ]
        },
        {
            "species": "SPECIES_SEADRA",
            "land": [],
            "water": [],
            "fishing": [ "spring", "summer", "autumn", "winter" ]
        },
        {
            "species": "SPECIES_LANTURN",
            "land": [],
            "water": [],
            "fishing": [ "spring", "summer", "autumn", "winter" ]
        },
        {
            "species": "SPECIES_OCTILLERY",
            "land": [],
            "water": [],
            "fishing": [ "spring", "summer", "autumn", "winter" ]
        }
    ]
}
