{
    "$schema": "habitat.schema.json",
    "land_text": "tall_grass",
    "habitats": {
        "land": true,
        "water": true,
        "fishing": true
    },
    "by_season": {
        "land": true,
        "water": true,
        "fishing": true
    },
    "species": [
        {
            "species": "SPECIES_ZANGOOSE",
            "land": [ "spring", "summer", "autumn", "winter" ],
            "water": [],
            "fishing": []
        },
        {
            "species": "SPECIES_SEVIPER",
            "land": [ "spring", "summer", "autumn", "winter" ],
            "water": [],
            "fishing": []
        },
        {
            "species": "SPECIES_RAPIDASH",
            "land": [ "spring", "summer", "autumn", "winter" ],
            "water": [],
            "fishing": []
        },
        {
            "species": "SPECIES_KANGASKHAN",
            "land": [ "spring", "summer", "autumn", "winter" ],
            "water": [],
            "fishing": []
        },
        {
            "species": "SPECIES_AXEW",
            "land": [ "spring", "summer", "autumn", "winter" ],
            "water": [],
            "fishing": []
        },
        {
            "species": "SPECIES_HAPPINY",
            "land": [ "spring" ],
            "water": [],
            "fishing": []
        },
        {
            "species": "SPECIES_CHANSEY",
            "land": [ "spring" ],
            "water": [],
            "fishing": []
        },
        {
            "species": "SPECIES_MILTANK",
            "land": [ "spring", "summer", "autumn", "winter" ],
            "water": [],
            "fishing": []
        },
        {
            "species": "SPECIES_BOUFFALANT",
            "land": [ "spring", "summer", "autumn", "winter" ],
            "water": [],
            "fishing": []
        },
        {
            "species": "SPECIES_TAUROS",
            "land": [ "spring", "summer", "autumn", "winter" ],
            "water": [],
            "fishing": []
        },
        {
            "species": "SPECIES_GIRAFARIG",
            "land": [ "spring", "summer", "autumn", "winter" ],
            "water": [],
            "fishing": []
        },
        {
            "species": "SPECIES_STANTLER",
            "land": [ "spring", "summer", "autumn", "winter" ],
            "water": [],
            "fishing": []
        },
        {
            "species": "SPECIES_AUDINO",
            "land": [ "spring", "summer", "autumn", "winter" ],
            "water": [],
            "fishing": []
        },
        {
            "species": "SPECIES_BLISSEY",
            "land": [ "spring" ],
            "water": [],
            "fishing": []
        },
        {
            "species": "SPECIES_FRAXURE",
            "land": [ "spring", "summer", "autumn", "winter" ],
            "water": [],
            "fishing": []
        },
        {
            "species": "SPECIES_BASCULIN",
            "land": [],
            "water": [ "spring", "summer", "autumn", "winter" ],
            "fishing": [ "spring", "summer", "autumn", "winter" ]
        },
        {
            "species": "SPECIES_TYMPOLE",
            "land": [],
            "water": [ "spring", "summer", "autumn", "winter" ],
            "fishing": []
        },
        {
            "species": "SPECIES_PSYDUCK",
            "land": [],
            "water": [ "spring", "summer", "autumn", "winter" ],
            "fishing": []
        },
        {
            "species": "SPECIES_PALPITOAD",
            "land": [],
            "water": [ "spring", "summer", "autumn", "winter" ],
            "fishing": []
        },
        {
            "species": "SPECIES_MAGIKARP",
            "land": [],
            "water": [],
            "fishing": [ "spring", "summer", "autumn", "winter" ]
        },
        {
            "species": "SPECIES_GOLDEEN",
            "land": [],
            "water": [],
            "fishing": [ "spring", "summer", "autumn", "winter" ]
        },
        {
            "species": "SPECIES_BARBOACH",
            "land": [],
            "water": [],
            "fishing": [ "spring", "summer", "autumn", "winter" ]
        },
        {
            "species": "SPECIES_SEAKING",
            "land": [],
            "water": [],
            "fishing": [ "spring", "summer", "autumn", "winter" ]
        },
        {
            "species": "SPECIES_WHISCASH",
            "land": [],
            "water": [],
            "fishing": [ "spring", "summer", "autumn", "winter" ]
        },
        {
            "species": "SPECIES_MUNCHLAX",
            "land": [ "summer" ],
            "water": [],
            "fishing": []
        },
        {
            "species": "SPECIES_SNORLAX",
            "land": [ "summer" ],
            "water": [],
            "fishing": []
        }
    ]
}
