{
    "$schema": "habitat.schema.json",
    "land_text": "land",
    "habitats": {
        "land": true,
        "water": true,
        "fishing": true
    },
    "by_season": {
        "land": true,
        "water": true,
        "fishing": true
    },
    "species": [
        {
            "species": "SPECIES_NATU",
            "land": [ "spring", "summer", "autumn", "winter" ],
            "water": [],
            "fishing": []
        },
        {
            "species": "SPECIES_PIDOVE",
            "land": [ "spring", "summer", "autumn", "winter" ],
            "water": [],
            "fishing": []
        },
        {
            "species": "SPECIES_XATU",
            "land": [ "spring", "summer", "autumn", "winter" ],
            "water": [],
            "fishing": []
        },
        {
            "species": "SPECIES_TRANQUILL",
            "land": [ "spring", "summer", "autumn", "winter" ],
            "water": [],
            "fishing": []
        },
        {
            "species": "SPECIES_ELGYEM",
            "land": [ "spring", "summer", "autumn", "winter" ],
            "water": [],
            "fishing": []
        },
        {
            "species": "SPECIES_CLEFFA",
            "land": [ "spring", "summer", "autumn", "winter" ],
            "water": [],
            "fishing": []
        },
        {
            "species": "SPECIES_LUNATONE",
            "land": [ "spring", "summer", "autumn", "winter" ],
            "water": [],
            "fishing": []
        },
        {
            "species": "SPECIES_SOLROCK",
            "land": [ "spring", "summer", "autumn", "winter" ],
            "water": [],
            "fishing": []
        },
        {
            "species": "SPECIES_UNFEZANT",
            "land": [ "spring", "summer", "autumn", "winter" ],
            "water": [],
            "fishing": []
        },
        {
            "species": "SPECIES_AUDINO",
            "land": [ "spring", "summer", "autumn", "winter" ],
            "water": [],
            "fishing": []
        },
        {
            "species": "SPECIES_CLEFAIRY",
            "land": [ "spring", "summer", "autumn", "winter" ],
            "water": [],
            "fishing": []
        },
        {
            "species": "SPECIES_BEHEEYEM",
            "land": [ "spring", "summer", "autumn", "winter" ],
            "water": [],
            "fishing": []
        },
        {
            "species": "SPECIES_ROGGENROLA",
            "land": [ "spring", "summer", "autumn", "winter" ],
            "water": [],
            "fishing": []
        },
        {
            "species": "SPECIES_ZUBAT",
            "land": [ "spring", "summer", "autumn", "winter" ],
            "water": [],
            "fishing": []
        },
        {
            "species": "SPECIES_BOLDORE",
            "land": [ "spring", "summer", "autumn", "winter" ],
            "water": [],
            "fishing": []
        },
        {
            "species": "SPECIES_GIGALITH",
            "land": [ "spring", "summer", "autumn", "winter" ],
            "water": [],
            "fishing": []
        },
        {
            "species": "SPECIES_DEINO",
            "land": [ "spring", "summer", "autumn", "winter" ],
            "water": [],
            "fishing": []
        },
        {
            "species": "SPECIES_GIBLE",
            "land": [ "spring", "summer", "autumn", "winter" ],
            "water": [],
            "fishing": []
        },
        {
            "species": "SPECIES_DUNSPARCE",
            "land": [ "spring", "summer", "autumn", "winter" ],
            "water": [],
            "fishing": []
        },
        {
            "species": "SPECIES_BELDUM",
            "land": [ "spring", "summer", "autumn", "winter" ],
            "water": [],
            "fishing": []
        },
        {
            "species": "SPECIES_EXCADRILL",
            "land": [ "spring", "summer", "autumn", "winter" ],
            "water": [],
            "fishing": []
        },
        {
            "species": "SPECIES_CROBAT",
            "land": [ "spring", "summer", "autumn", "winter" ],
            "water": [],
            "fishing": []
        },
        {
            "species": "SPECIES_ZWEILOUS",
            "land": [ "spring", "summer", "autumn", "winter" ],
            "water": [],
            "fishing": []
        },
        {
            "species": "SPECIES_METANG",
            "land": [ "spring", "summer", "autumn", "winter" ],
            "water": [],
            "fishing": []
        },
        {
            "species": "SPECIES_GABITE",
            "land": [ "spring", "summer", "autumn", "winter" ],
            "water": [],
            "fishing": []
        },
        {
            "species": "SPECIES_BASCULIN",
            "land": [],
            "water": [ "spring", "summer", "autumn", "winter" ],
            "fishing": [ "spring", "summer", "autumn", "winter" ]
        },
        {
            "species": "SPECIES_TYMPOLE",
            "land": [],
            "water": [ "spring", "summer", "autumn", "winter" ],
            "fishing": []
        },
        {
            "species": "SPECIES_GOLDUCK",
            "land": [],
            "water": [ "spring", "summer", "autumn", "winter" ],
            "fishing": []
        },
        {
            "species": "SPECIES_PSYDUCK",
            "land": [],
            "water": [ "spring", "summer", "autumn", "winter" ],
            "fishing": []
        },
        {
            "species": "SPECIES_PALPITOAD",
            "land": [],
            "water": [ "spring", "summer", "autumn", "winter" ],
            "fishing": []
        }
    ]
}
