{
    "$schema": "habitat.schema.json",
    "land_text": "tall_grass",
    "habitats": {
        "land": true,
        "water": true,
        "fishing": true
    },
    "by_season": {
        "land": true,
        "water": true,
        "fishing": true
    },
    "species": [
        {
            "species": "SPECIES_FARFETCHD",
            "land": [ "spring", "summer", "autumn", "winter" ],
            "water": [],
            "fishing": []
        },
        {
            "species": "SPECIES_IGGLYBUFF",
            "land": [ "spring", "summer", "autumn", "winter" ],
            "water": [],
            "fishing": []
        },
        {
            "species": "SPECIES_PACHIRISU",
            "land": [ "spring", "summer", "autumn" ],
            "water": [],
            "fishing": []
        },
        {
            "species": "SPECIES_BIDOOF",
            "land": [ "spring", "summer", "autumn", "winter" ],
            "water": [],
            "fishing": []
        },
        {
            "species": "SPECIES_JIGGLYPUFF",
            "land": [ "spring", "summer", "autumn", "winter" ],
            "water": [],
            "fishing": []
        },
        {
            "species": "SPECIES_MUNCHLAX",
            "land": [ "spring", "summer" ],
            "water": [],
            "fishing": []
        },
        {
            "species": "SPECIES_PLUSLE",
            "land": [ "spring", "summer", "autumn", "winter" ],
            "water": [],
            "fishing": []
        },
        {
            "species": "SPECIES_MINUN",
            "land": [ "spring", "summer", "autumn", "winter" ],
            "water": [],
            "fishing": []
        },
        {
            "species": "SPECIES_GLAMEOW",
            "land": [ "spring", "summer", "autumn", "winter" ],
            "water": [],
            "fishing": []
        },
        {
            "species": "SPECIES_PIDOVE",
            "land": [ "spring", "winter" ],
            "water": [],
            "fishing": []
        },
        {
            "species": "SPECIES_LICKITUNG",
            "land": [ "spring", "summer", "autumn", "winter" ],
            "water": [],
            "fishing": []
        },
        {
            "species": "SPECIES_BIBAREL",
            "land": [ "spring", "summer", "autumn" ],
            "water": [ "spring", "summer", "autumn", "winter" ],
            "fishing": []
        },
        {
            "species": "SPECIES_PURUGLY",
            "land": [ "spring", "summer", "autumn" ],
            "water": [],
            "fishing": []
        },
        {
            "species": "SPECIES_AUDINO",
            "land": [ "spring", "summer", "autumn", "winter" ],
            "water": [],
            "fishing": []
        },
        {
            "species": "SPECIES_BONSLY",
            "land": [ "spring", "summer", "autumn", "winter" ],
            "water": [],
            "fishing": []
        },
        {
            "species": "SPECIES_SNORLAX",
            "land": [ "spring", "summer", "autumn" ],
            "water": [],
            "fishing": []
        },
        {
            "species": "SPECIES_BASCULIN",
            "land": [],
            "water": [ "spring", "summer", "autumn", "winter" ],
            "fishing": []
        },
        {
            "species": "SPECIES_MARILL",
            "land": [],
            "water": [ "spring", "summer", "autumn", "winter" ],
            "fishing": []
        },
        {
            "species": "SPECIES_PSYDUCK",
            "land": [],
            "water": [ "spring", "summer", "autumn", "winter" ],
            "fishing": []
        },
        {
            "species": "SPECIES_SEAKING",
            "land": [],
            "water": [ "spring", "summer", "autumn", "winter" ],
            "fishing": [ "spring", "summer", "autumn", "winter" ]
        },
        {
            "species": "SPECIES_AZUMARILL",
            "land": [],
            "water": [ "spring", "summer", "autumn", "winter" ],
            "fishing": []
        },
        {
            "species": "SPECIES_GOLDEEN",
            "land": [],
            "water": [],
            "fishing": [ "spring", "autumn", "winter" ]
        },
        {
            "species": "SPECIES_MAGIKARP",
            "land": [],
            "water": [],
            "fishing": [ "spring", "summer", "autumn", "winter" ]
        },
        {
            "species": "SPECIES_BARBOACH",
            "land": [],
            "water": [],
            "fishing": [ "spring", "summer", "winter" ]
        },
        {
            "species": "SPECIES_CORPHISH",
            "land": [],
            "water": [],
            "fishing": [ "spring", "summer", "autumn", "winter" ]
        },
        {
            "species": "SPECIES_WHISCASH",
            "land": [],
            "water": [],
            "fishing": [ "spring", "summer", "autumn", "winter" ]
        },
        {
            "species": "SPECIES_CRAWDAUNT",
            "land": [],
            "water": [],
            "fishing": [ "spring", "summer", "autumn", "winter" ]
        },
        {
            "species": "SPECIES_GYARADOS",
            "land": [],
            "water": [],
            "fishing": [ "spring", "summer", "autumn", "winter" ]
        },
        {
            "species": "SPECIES_KRICKETOT",
            "land": [ "summer", "autumn" ],
            "water": [],
            "fishing": []
        },
        {
            "species": "SPECIES_KRICKETUNE",
            "land": [ "summer", "autumn" ],
            "water": [],
            "fishing": []
        }
    ]
}
