{
    "$schema": "habitat.schema.json",
    "land_text": "tall_grass",
    "habitats": {
        "land": true,
        "water": false,
        "fishing": false
    },
    "by_season": {
        "land": true,
        "water": true,
        "fishing": true
    },
    "species": [
        {
            "species": "SPECIES_ZIGZAGOON",
            "land": [ "spring", "summer", "autumn", "winter" ],
            "water": [],
            "fishing": []
        },
        {
            "species": "SPECIES_MEOWTH",
            "land": [ "spring", "summer", "autumn", "winter" ],
            "water": [],
            "fishing": []
        },
        {
            "species": "SPECIES_PURRLOIN",
            "land": [ "spring", "summer", "autumn", "winter" ],
            "water": [],
            "fishing": []
        },
        {
            "species": "SPECIES_SNUBBULL",
            "land": [ "spring", "summer", "autumn", "winter" ],
            "water": [],
            "fishing": []
        },
        {
            "species": "SPECIES_LINOONE",
            "land": [ "spring", "summer", "autumn", "winter" ],
            "water": [],
            "fishing": []
        },
        {
            "species": "SPECIES_PERSIAN",
            "land": [ "spring", "summer", "autumn", "winter" ],
            "water": [],
            "fishing": []
        },
        {
            "species": "SPECIES_SKITTY",
            "land": [ "spring", "summer", "autumn", "winter" ],
            "water": [],
            "fishing": []
        },
        {
            "species": "SPECIES_MIME_JR",
            "land": [ "spring", "autumn" ],
            "water": [],
            "fishing": []
        },
        {
            "species": "SPECIES_SMEARGLE",
            "land": [ "spring", "summer", "autumn", "winter" ],
            "water": [],
            "fishing": []
        },
        {
            "species": "SPECIES_EEVEE",
            "land": [ "spring", "summer", "autumn", "winter" ],
            "water": [],
            "fishing": []
        },
        {
            "species": "SPECIES_GLAMEOW",
            "land": [ "spring", "summer", "autumn", "winter" ],
            "water": [],
            "fishing": []
        },
        {
            "species": "SPECIES_MINCCINO",
            "land": [ "spring", "summer", "autumn", "winter" ],
            "water": [],
            "fishing": []
        },
        {
            "species": "SPECIES_TRUBBISH",
            "land": [ "spring", "summer", "autumn", "winter" ],
            "water": [],
            "fishing": []
        },
        {
            "species": "SPECIES_LILLIPUP",
            "land": [ "spring", "summer", "autumn", "winter" ],
            "water": [],
            "fishing": []
        },
        {
            "species": "SPECIES_AUDINO",
            "land": [ "spring", "summer", "autumn", "winter" ],
            "water": [],
            "fishing": []
        },
        {
            "species": "SPECIES_DELCATTY",
            "land": [ "spring", "summer", "autumn", "winter" ],
            "water": [],
            "fishing": []
        },
        {
            "species": "SPECIES_LIEPARD",
            "land": [ "spring", "summer", "autumn", "winter" ],
            "water": [],
            "fishing": []
        },
        {
            "species": "SPECIES_HERDIER",
            "land": [ "summer", "winter" ],
            "water": [],
            "fishing": []
        }
    ]
}
